date_scraped,source,title,url
2026-07-12 18:59:18,hackernews,AI boosts research careers but narrow the span of ideas explored: study(ieee.org),https://spectrum.ieee.org/ai-science-research-flattens-discovery
2026-07-12 18:59:18,hackernews,Mesh LLM: distributed AI computing on iroh(iroh.computer),https://www.iroh.computer/blog/mesh-llm
2026-07-13 11:57:45,hackernews,Ask HN: Does anyone let AI agents play games just for fun?,https://news.ycombinator.com/item?id=48848741
2026-07-13 11:57:45,hackernews,Ask HN: Add flag for AI-generated articles,https://news.ycombinator.com/item?id=48886741
2026-07-13 11:57:45,hackernews,"Migrating a production AI agent to GPT-5.6: 2.2x faster, 27% cheaper(ploy.ai)",https://ploy.ai/blog/migrating-a-production-ai-agent-to-gpt-5-6
2026-07-13 19:18:45,hackernews,"Show HN: BillAI Bass, an AI-Powered Big Mouth Billy Bass Using Strands Agents(github.com/morganwilliscloud)",https://github.com/morganwilliscloud/billai-bass
